name,cost,duration_days,prepayment
Интеграция нагрузочного тестирования,686000.00,74,248400.00
Внедрение панели администратора на основе существующего решения,689000.00,81,231600.00
Проектирование облачной инфраструктуры (Enterprise),691000.00,64,323200.00
Проектирование базы данных (Enterprise),692500.00,84,342600.00
Миграция CRM-системы (SaaS),693000.00,59,230100.00
Проектирование системы аутентификации,693000.00,49,284100.00
Проектирование платёжного модуля под ключ,693500.00,56,208300.00
Внедрение облачной инфраструктуры под ключ,699500.00,53,204100.00
Внедрение системы управления задачами (POC),702500.00,63,249500.00
Внедрение системы аналитики на основе существующего решения,706500.00,67,190300.00
Внедрение облачной инфраструктуры с нуля,707500.00,81,249900.00
Разработка мобильного приложения с нуля,707500.00,60,313200.00
Внедрение системы управления задачами,710000.00,82,201500.00
Проектирование API-сервиса с нуля,711500.00,80,219600.00
Проектирование системы мониторинга (MVP),712500.00,92,320700.00
Миграция микросервисной архитектуры,715500.00,61,327400.00
Интеграция базы данных (POC),725500.00,55,193400.00
Проектирование системы мониторинга с нуля,735500.00,76,245900.00
Проектирование веб-приложения с нуля,738000.00,54,279500.00
Проектирование микросервисной архитектуры с нуля,747500.00,63,206500.00
Миграция сети доставки контента (Enterprise),747500.00,67,267900.00
Интеграция базы данных (POC),750500.00,66,344200.00
Проектирование чат-бота (MVP),751500.00,89,340600.00
Проектирование нагрузочного тестирования,758000.00,95,270700.00
Проектирование CRM-системы (MVP),762000.00,55,222700.00
Проектирование нагрузочного тестирования (SaaS),762000.00,61,362000.00
Миграция корпоративного портала на основе существующего решения,762000.00,89,376600.00
Проектирование нагрузочного тестирования под ключ,766000.00,82,321200.00
Интеграция облачной инфраструктуры с нуля,770500.00,59,284400.00
Внедрение облачной инфраструктуры (MVP),771500.00,95,269700.00
Интеграция ERP-системы на основе существующего решения,771500.00,67,282300.00
Проектирование системы аутентификации (MVP),774000.00,98,315300.00
Миграция системы аутентификации (SaaS),776500.00,57,256800.00
Интеграция веб-приложения на основе существующего решения,777500.00,85,358300.00
Внедрение ERP-системы (POC),780000.00,87,195000.00
Внедрение системы аутентификации (Enterprise),780000.00,63,218000.00
Внедрение CRM-системы (SaaS),782000.00,59,389900.00
Разработка системы аналитики (SaaS),782500.00,83,382400.00
Интеграция системы аналитики (Enterprise),787500.00,58,267700.00
Миграция облачной инфраструктуры (POC),788000.00,65,381300.00
Миграция системы аутентификации,790500.00,92,299800.00
Интеграция платёжного модуля (SaaS),794500.00,98,213100.00
Проектирование системы мониторинга на основе существующего решения,795500.00,62,311400.00
Внедрение чат-бота (POC),799000.00,65,244300.00
Внедрение корпоративного портала с нуля,805500.00,77,256900.00
Внедрение API-сервиса (POC),806500.00,70,396800.00
Миграция API-сервиса,812500.00,58,314300.00
Разработка системы мониторинга (POC),815000.00,65,345500.00
Внедрение корпоративного портала под ключ,824500.00,75,288200.00
Разработка панели администратора (SaaS),828000.00,94,229300.00
Интеграция системы мониторинга на основе существующего решения,828000.00,67,342700.00
Миграция корпоративного портала (POC),834500.00,91,351900.00
Внедрение микросервисной архитектуры на основе существующего решения,835500.00,64,240300.00
Миграция корпоративного портала с нуля,837500.00,98,386400.00
Миграция микросервисной архитектуры (POC),840000.00,88,401700.00
Внедрение базы данных (POC),842500.00,65,334900.00
Разработка чат-бота (Enterprise),849000.00,86,409200.00
Миграция системы аналитики (POC),849500.00,61,322700.00
Миграция микросервисной архитектуры (POC),855000.00,62,272300.00
Интеграция нагрузочного тестирования (POC),857000.00,78,257700.00
Интеграция базы данных с нуля,863000.00,88,218400.00
Миграция DevOps-пайплайна на основе существующего решения,867500.00,70,244000.00
Внедрение системы аналитики с нуля,868000.00,93,340100.00
Интеграция системы управления задачами с нуля,868500.00,102,251800.00
Разработка веб-приложения (SaaS),870500.00,111,229100.00
Миграция облачной инфраструктуры с нуля,876500.00,92,245400.00
Интеграция мобильного приложения,883000.00,104,337500.00
Интеграция системы мониторинга (POC),884000.00,84,292100.00
Разработка микросервисной архитектуры под ключ,884500.00,89,308600.00
Миграция API-сервиса с нуля,884500.00,73,350300.00
Миграция системы мониторинга (SaaS),888000.00,93,277500.00
Внедрение базы данных (POC),889500.00,76,346900.00
Интеграция системы аутентификации под ключ,893000.00,83,333300.00
Разработка системы резервного копирования,896500.00,85,418400.00
Миграция мобильного приложения,897000.00,70,344300.00
Внедрение ERP-системы с нуля,904000.00,102,235500.00
Интеграция платёжного модуля (MVP),914000.00,97,244000.00
Интеграция системы аутентификации (MVP),922500.00,88,453900.00
Интеграция облачной инфраструктуры на основе существующего решения,924500.00,100,386500.00
Интеграция базы данных (POC),925500.00,70,410700.00
Интеграция системы управления задачами (MVP),926500.00,71,254100.00
Разработка системы управления задачами (Enterprise),927000.00,117,280400.00
Интеграция платёжного модуля (POC),935500.00,102,244800.00
Внедрение корпоративного портала (Enterprise),938500.00,66,306400.00
Внедрение ERP-системы под ключ,943500.00,101,281100.00
Интеграция чат-бота с нуля,946500.00,78,249900.00
Разработка системы мониторинга (Enterprise),950000.00,82,303600.00
Разработка облачной инфраструктуры под ключ,952000.00,120,299700.00
Разработка чат-бота (POC),955500.00,68,348500.00
Разработка ERP-системы (Enterprise),972500.00,81,444700.00
Интеграция системы управления задачами с нуля,995000.00,125,390700.00
Интеграция CRM-системы (Enterprise),1007500.00,111,407300.00
Интеграция сети доставки контента под ключ,1011000.00,118,477600.00
Интеграция микросервисной архитектуры под ключ,1012500.00,114,366500.00
Разработка DevOps-пайплайна (Enterprise),1020000.00,112,463800.00
Внедрение ERP-системы (MVP),1024500.00,92,307000.00
Разработка микросервисной архитектуры на основе существующего решения,1029500.00,110,319900.00
Разработка системы аутентификации,1031500.00,79,289800.00
Интеграция системы аутентификации (POC),1052000.00,125,410700.00
Интеграция платёжного модуля (Enterprise),1052000.00,133,453500.00
Разработка веб-приложения под ключ,1052500.00,88,472900.00
Внедрение корпоративного портала (POC),1075500.00,109,387400.00
Внедрение корпоративного портала (MVP),1080000.00,108,511700.00
Интеграция сети доставки контента под ключ,1083000.00,127,318700.00
Внедрение API-сервиса (MVP),1092000.00,104,316500.00
Внедрение корпоративного портала,1096000.00,138,429800.00
Разработка системы резервного копирования на основе существующего решения,1096000.00,93,537800.00
Разработка корпоративного портала (POC),1101000.00,119,388300.00
Разработка ERP-системы (MVP),1108000.00,117,506700.00
Интеграция системы управления задачами с нуля,1108500.00,129,418600.00
Интеграция системы управления задачами на основе существующего решения,1114500.00,107,387200.00
Разработка системы аналитики на основе существующего решения,1119000.00,88,342500.00
Внедрение мобильного приложения,1123500.00,98,433800.00
Внедрение системы управления задачами (Enterprise),1124500.00,93,503600.00
Внедрение системы управления задачами с нуля,1126000.00,119,455500.00
Интеграция панели администратора (MVP),1130500.00,91,335300.00
Интеграция платёжного модуля (POC),1141500.00,129,539600.00
Интеграция системы управления задачами под ключ,1141500.00,96,566800.00
Интеграция облачной инфраструктуры под ключ,1144500.00,103,364800.00
Интеграция системы аналитики (SaaS),1156000.00,150,486800.00
Внедрение системы аналитики (Enterprise),1159000.00,144,474900.00
Интеграция ERP-системы (MVP),1163000.00,85,344900.00
Интеграция платёжного модуля (MVP),1180000.00,113,396300.00
Интеграция CRM-системы (SaaS),1185000.00,147,462100.00
Внедрение сети доставки контента (Enterprise),1186500.00,92,541400.00
Внедрение системы аналитики на основе существующего решения,1187000.00,134,577800.00
Разработка API-сервиса (POC),1196500.00,147,573800.00
Разработка чат-бота (SaaS),1204000.00,120,583500.00
Внедрение микросервисной архитектуры с нуля,1211500.00,100,520300.00
Разработка нагрузочного тестирования (Enterprise),1213500.00,124,310100.00
Разработка CRM-системы с нуля,1227500.00,121,551400.00
Разработка системы аутентификации,1234000.00,145,445300.00
Разработка ERP-системы на основе существующего решения,1240000.00,135,320300.00
Разработка базы данных (SaaS),1257500.00,133,491900.00
Внедрение системы аутентификации (Enterprise),1272500.00,146,343100.00
Внедрение системы резервного копирования (SaaS),1274500.00,141,361500.00
Разработка корпоративного портала (POC),1279500.00,149,614100.00
Разработка системы управления задачами (MVP),1282500.00,90,404000.00
Внедрение системы аналитики,1292000.00,108,582700.00
Внедрение облачной инфраструктуры,1298500.00,116,643500.00
Внедрение платёжного модуля,1305000.00,94,512500.00
Внедрение мобильного приложения,1314000.00,144,458500.00
Внедрение системы резервного копирования с нуля,1326500.00,171,432900.00
Разработка системы мониторинга на основе существующего решения,1328000.00,113,390300.00
Внедрение системы мониторинга на основе существующего решения,1336000.00,143,340800.00
Внедрение DevOps-пайплайна на основе существующего решения,1340000.00,167,577200.00
Разработка микросервисной архитектуры (Enterprise),1346000.00,140,442300.00
Внедрение чат-бота под ключ,1350500.00,165,351700.00
Разработка системы аутентификации с нуля,1364000.00,139,645700.00
Внедрение системы аналитики (POC),1374000.00,119,624400.00
Внедрение корпоративного портала (Enterprise),1390500.00,175,434800.00
Внедрение веб-приложения (MVP),1400000.00,148,558200.00
Разработка системы резервного копирования (POC),1402500.00,150,621500.00
Внедрение сети доставки контента (POC),1408000.00,137,459400.00
Внедрение мобильного приложения (MVP),1424000.00,159,521600.00
Разработка системы аналитики с нуля,1449000.00,117,520000.00
Разработка нагрузочного тестирования под ключ,1450000.00,138,493900.00
Внедрение нагрузочного тестирования (SaaS),1477500.00,129,708300.00
Разработка платёжного модуля (POC),1482000.00,149,488700.00
Разработка мобильного приложения с нуля,1486500.00,105,410100.00
Разработка мобильного приложения (POC),1498500.00,131,480600.00
Внедрение системы мониторинга,1499500.00,129,592800.00
Разработка корпоративного портала с нуля,1504500.00,115,566400.00
Разработка API-сервиса (Enterprise),1511000.00,155,432300.00
Разработка облачной инфраструктуры (MVP),1512500.00,167,527500.00
Разработка DevOps-пайплайна на основе существующего решения,1522500.00,107,486200.00
Разработка платёжного модуля под ключ,1531000.00,142,690900.00
Разработка веб-приложения с нуля,1556000.00,115,544500.00
Разработка веб-приложения (SaaS),1567000.00,131,466800.00
Разработка ERP-системы на основе существующего решения,1569500.00,121,460500.00
Разработка системы управления задачами (SaaS),1571500.00,179,479600.00
Разработка системы аналитики на основе существующего решения,1572000.00,137,658300.00
Разработка CRM-системы (SaaS),1621500.00,120,550700.00
Разработка платёжного модуля (POC),1663000.00,155,698900.00
Разработка микросервисной архитектуры (MVP),1709500.00,128,517500.00
Разработка DevOps-пайплайна под ключ,1709500.00,209,848900.00
Разработка панели администратора (Enterprise),1730000.00,168,789900.00
Разработка чат-бота (MVP),1774500.00,140,876800.00
Разработка CRM-системы (MVP),1823000.00,128,887600.00
Разработка ERP-системы (SaaS),1835500.00,134,755300.00
Разработка мобильного приложения под ключ,1887500.00,229,491100.00
Разработка API-сервиса (POC),1932500.00,169,695500.00
