name,cost,duration_days,prepayment
Оптимизация корпоративного портала (SaaS),285000.00,29,132300.00
Интеграция мобильного приложения (SaaS),286000.00,32,96800.00
Аудит панели администратора под ключ,287000.00,26,90400.00
Разработка нагрузочного тестирования (POC),288000.00,29,108600.00
Тестирование системы резервного копирования (POC),291500.00,22,103400.00
Аудит CRM-системы,293000.00,29,99000.00
Аудит CRM-системы под ключ,293000.00,28,136900.00
Оптимизация ERP-системы (MVP),294500.00,28,146600.00
Аудит CRM-системы (MVP),299000.00,37,118900.00
Тестирование нагрузочного тестирования,300000.00,29,104100.00
Развёртывание DevOps-пайплайна с нуля,300000.00,27,109100.00
Развёртывание системы резервного копирования (MVP),301500.00,30,141500.00
Тестирование базы данных (SaaS),303000.00,22,96800.00
Проектирование DevOps-пайплайна (MVP),303000.00,38,132500.00
Оптимизация нагрузочного тестирования под ключ,303500.00,33,116900.00
Проектирование платёжного модуля на основе существующего решения,304000.00,32,131500.00
Тестирование панели администратора (Enterprise),307500.00,22,97500.00
Оптимизация API-сервиса (POC),307500.00,26,139300.00
Тестирование API-сервиса с нуля,309500.00,38,106200.00
Оптимизация облачной инфраструктуры под ключ,310500.00,30,103500.00
Внедрение чат-бота,313500.00,23,79800.00
Внедрение API-сервиса на основе существующего решения,314500.00,28,143500.00
Оптимизация нагрузочного тестирования на основе существующего решения,315500.00,33,136800.00
Оптимизация системы управления задачами (POC),316500.00,26,123400.00
Проектирование системы управления задачами на основе существующего решения,317000.00,39,118000.00
Оптимизация микросервисной архитектуры (Enterprise),319000.00,28,139700.00
Интеграция базы данных,319500.00,28,137300.00
Тестирование системы аналитики,321000.00,34,85900.00
Тестирование платёжного модуля (SaaS),322000.00,26,91600.00
Миграция платёжного модуля (SaaS),322500.00,37,90100.00
Развёртывание нагрузочного тестирования (Enterprise),322500.00,24,112700.00
Оптимизация ERP-системы (SaaS),322500.00,38,122700.00
Тестирование панели администратора под ключ,323500.00,35,161300.00
Тестирование системы резервного копирования (Enterprise),324000.00,31,111700.00
Интеграция API-сервиса (MVP),325500.00,39,154100.00
Проектирование сети доставки контента (POC),327500.00,39,84500.00
Развёртывание корпоративного портала (Enterprise),327500.00,27,90100.00
Внедрение системы аутентификации на основе существующего решения,329500.00,23,114300.00
Проектирование системы управления задачами с нуля,329500.00,35,122600.00
Тестирование системы резервного копирования (SaaS),330000.00,29,84000.00
Развёртывание системы резервного копирования с нуля,331000.00,36,133900.00
Развёртывание платёжного модуля на основе существующего решения,332500.00,34,119100.00
Тестирование корпоративного портала (Enterprise),332500.00,40,135100.00
Интеграция системы резервного копирования (MVP),334000.00,37,119800.00
Интеграция базы данных (POC),335000.00,42,107900.00
Проектирование облачной инфраструктуры (SaaS),335000.00,38,152000.00
Тестирование облачной инфраструктуры,335500.00,44,114200.00
Миграция сети доставки контента (SaaS),338000.00,33,132000.00
Миграция панели администратора под ключ,338500.00,40,89100.00
Развёртывание базы данных,339000.00,40,124200.00
Тестирование микросервисной архитектуры (MVP),341000.00,40,126600.00
Проектирование мобильного приложения,341500.00,26,150600.00
Тестирование мобильного приложения (POC),343500.00,34,138200.00
Внедрение API-сервиса,346000.00,31,95700.00
Развёртывание системы управления задачами (MVP),346000.00,27,122800.00
Тестирование облачной инфраструктуры под ключ,346500.00,38,130000.00
Интеграция микросервисной архитектуры (MVP),348500.00,42,114200.00
Оптимизация системы мониторинга (MVP),350500.00,30,104400.00
Тестирование чат-бота,350500.00,41,147900.00
Интеграция корпоративного портала под ключ,351500.00,33,102600.00
Оптимизация облачной инфраструктуры на основе существующего решения,352500.00,31,109900.00
Проектирование платёжного модуля (SaaS),353000.00,45,121300.00
Тестирование API-сервиса (POC),355000.00,28,144000.00
Развёртывание API-сервиса под ключ,355500.00,44,101800.00
Проектирование мобильного приложения под ключ,357000.00,27,104100.00
Тестирование ERP-системы с нуля,357000.00,45,117700.00
Тестирование нагрузочного тестирования (SaaS),358500.00,37,92900.00
Миграция платёжного модуля,358500.00,33,162900.00
Тестирование системы мониторинга (SaaS),361000.00,36,115000.00
Развёртывание корпоративного портала (MVP),364000.00,34,166700.00
Оптимизация нагрузочного тестирования на основе существующего решения,365500.00,32,94600.00
Миграция системы управления задачами (POC),366000.00,45,96800.00
Развёртывание DevOps-пайплайна (POC),367000.00,39,118300.00
Интеграция платёжного модуля (Enterprise),369000.00,30,103400.00
Внедрение системы мониторинга (POC),370000.00,32,164700.00
Оптимизация платёжного модуля под ключ,372000.00,26,101900.00
Тестирование облачной инфраструктуры на основе существующего решения,372500.00,42,137200.00
Разработка ERP-системы (MVP),373500.00,29,163500.00
Оптимизация системы управления задачами (SaaS),374500.00,45,99200.00
Внедрение системы резервного копирования на основе существующего решения,375000.00,42,157200.00
Развёртывание сети доставки контента на основе существующего решения,377500.00,34,114500.00
Внедрение API-сервиса с нуля,379000.00,44,106100.00
Развёртывание DevOps-пайплайна на основе существующего решения,380500.00,36,175800.00
Развёртывание корпоративного портала (POC),382000.00,48,133700.00
Интеграция веб-приложения на основе существующего решения,383000.00,47,162800.00
Оптимизация системы аналитики (Enterprise),383000.00,49,169200.00
Тестирование системы аналитики (Enterprise),385500.00,46,132600.00
Интеграция нагрузочного тестирования (MVP),387000.00,35,117600.00
Развёртывание платёжного модуля с нуля,387500.00,45,144500.00
Оптимизация облачной инфраструктуры (SaaS),388000.00,34,117900.00
Оптимизация системы резервного копирования (POC),388000.00,37,118700.00
Миграция облачной инфраструктуры с нуля,388000.00,49,184100.00
Тестирование сети доставки контента (Enterprise),389500.00,43,118300.00
Оптимизация микросервисной архитектуры на основе существующего решения,390500.00,48,149900.00
Внедрение панели администратора (MVP),392000.00,47,100100.00
Развёртывание платёжного модуля (SaaS),392000.00,46,162900.00
Разработка чат-бота (SaaS),393000.00,31,195500.00
Миграция DevOps-пайплайна на основе существующего решения,393500.00,33,176000.00
Миграция системы аналитики (MVP),393500.00,43,182700.00
Тестирование веб-приложения (MVP),394000.00,31,138700.00
Разработка веб-приложения (Enterprise),396000.00,42,152000.00
Миграция DevOps-пайплайна (POC),396000.00,41,161100.00
Миграция панели администратора на основе существующего решения,398000.00,39,103500.00
Проектирование системы аутентификации (POC),399000.00,34,163400.00
Оптимизация ERP-системы,400500.00,35,115500.00
Разработка базы данных под ключ,400500.00,47,174400.00
Разработка корпоративного портала под ключ,405500.00,40,181200.00
Миграция базы данных,408000.00,48,123500.00
Развёртывание сети доставки контента,410000.00,34,170800.00
Миграция системы резервного копирования (SaaS),410500.00,30,135600.00
Проектирование нагрузочного тестирования под ключ,413000.00,51,127700.00
Развёртывание чат-бота (MVP),414500.00,31,153400.00
Оптимизация DevOps-пайплайна (POC),414500.00,51,204700.00
Развёртывание системы управления задачами,417500.00,44,198300.00
Оптимизация платёжного модуля,418500.00,34,119900.00
Оптимизация облачной инфраструктуры под ключ,423000.00,40,144300.00
Интеграция сети доставки контента,423500.00,48,135700.00
Развёртывание нагрузочного тестирования с нуля,425000.00,33,137200.00
Оптимизация сети доставки контента (SaaS),428500.00,49,207200.00
Миграция системы аутентификации (POC),429000.00,39,150000.00
Миграция платёжного модуля (MVP),433000.00,41,133900.00
Развёртывание DevOps-пайплайна (SaaS),434000.00,51,133200.00
Оптимизация базы данных (POC),434000.00,45,144500.00
Оптимизация платёжного модуля (SaaS),437500.00,34,116000.00
Развёртывание микросервисной архитектуры,439500.00,45,138800.00
Интеграция корпоративного портала (POC),440000.00,33,177400.00
Разработка CRM-системы на основе существующего решения,440500.00,53,203200.00
Развёртывание ERP-системы под ключ,441500.00,33,218100.00
Проектирование нагрузочного тестирования (MVP),442000.00,38,167400.00
Разработка системы аналитики,445000.00,42,213100.00
Миграция DevOps-пайплайна (Enterprise),446500.00,37,129300.00
Оптимизация чат-бота с нуля,447000.00,50,142600.00
Оптимизация системы управления задачами под ключ,447000.00,36,155200.00
Оптимизация системы аутентификации,447500.00,34,189100.00
Развёртывание базы данных (POC),447500.00,46,223300.00
Развёртывание нагрузочного тестирования (Enterprise),449000.00,51,127800.00
Проектирование системы аналитики на основе существующего решения,449500.00,40,167900.00
Развёртывание базы данных,450000.00,45,172300.00
Оптимизация ERP-системы на основе существующего решения,450500.00,33,149300.00
Проектирование панели администратора (SaaS),452000.00,33,127400.00
Оптимизация базы данных с нуля,454500.00,47,156600.00
Оптимизация корпоративного портала (SaaS),456500.00,56,139400.00
Развёртывание нагрузочного тестирования (SaaS),458000.00,49,175600.00
Миграция системы управления задачами с нуля,458000.00,56,186800.00
Оптимизация мобильного приложения (SaaS),461000.00,41,189800.00
Оптимизация системы аналитики (Enterprise),463500.00,57,208000.00
Миграция облачной инфраструктуры,464500.00,50,141700.00
Внедрение системы управления задачами (MVP),467000.00,36,162500.00
Миграция облачной инфраструктуры (POC),471500.00,46,143200.00
Оптимизация нагрузочного тестирования под ключ,471500.00,46,194700.00
Внедрение панели администратора (POC),472500.00,60,203600.00
Оптимизация корпоративного портала (POC),473500.00,38,139700.00
Оптимизация платёжного модуля (POC),474500.00,46,229400.00
Внедрение сети доставки контента на основе существующего решения,479500.00,42,122400.00
Внедрение DevOps-пайплайна (POC),483500.00,61,218300.00
Развёртывание чат-бота (Enterprise),486000.00,53,214000.00
Миграция корпоративного портала,488000.00,38,240600.00
Разработка мобильного приложения (SaaS),490500.00,63,124300.00
Проектирование системы аутентификации с нуля,491000.00,57,141400.00
Оптимизация базы данных на основе существующего решения,492500.00,43,180700.00
Оптимизация системы мониторинга под ключ,493500.00,61,222200.00
Оптимизация сети доставки контента (POC),494000.00,57,219900.00
Развёртывание системы аутентификации (MVP),494500.00,51,237400.00
Проектирование системы аутентификации (SaaS),496000.00,35,196900.00
Оптимизация веб-приложения (Enterprise),496500.00,39,205500.00
Миграция платёжного модуля (Enterprise),496500.00,56,218400.00
Миграция платёжного модуля под ключ,497000.00,39,209000.00
Оптимизация мобильного приложения (SaaS),499000.00,58,152300.00
Проектирование нагрузочного тестирования (Enterprise),502500.00,60,150300.00
Миграция нагрузочного тестирования (Enterprise),503000.00,57,244100.00
Развёртывание API-сервиса,503500.00,54,230400.00
Развёртывание панели администратора (SaaS),505000.00,62,134900.00
Разработка системы мониторинга,507500.00,55,194000.00
Развёртывание платёжного модуля (POC),510000.00,66,253000.00
Интеграция чат-бота под ключ,513500.00,41,197300.00
Развёртывание CRM-системы на основе существующего решения,514500.00,51,182200.00
Разработка базы данных (POC),515500.00,65,226000.00
Развёртывание базы данных (SaaS),517500.00,57,142700.00
Развёртывание корпоративного портала под ключ,517500.00,42,182600.00
Интеграция системы аналитики (SaaS),517500.00,58,186300.00
Развёртывание ERP-системы (MVP),523000.00,44,239000.00
Миграция ERP-системы на основе существующего решения,525500.00,39,205600.00
Развёртывание чат-бота (MVP),527000.00,64,146100.00
Проектирование панели администратора с нуля,528000.00,43,140100.00
Миграция системы аналитики на основе существующего решения,528500.00,54,241800.00
Проектирование веб-приложения,530000.00,51,195800.00
Интеграция нагрузочного тестирования (Enterprise),531000.00,59,229100.00
Интеграция системы аналитики (SaaS),532500.00,56,135800.00
Миграция системы аутентификации (POC),534500.00,44,186700.00
Развёртывание системы резервного копирования с нуля,534500.00,45,220500.00
Развёртывание платёжного модуля на основе существующего решения,537000.00,41,211600.00
Проектирование микросервисной архитектуры с нуля,537500.00,60,156200.00
Развёртывание DevOps-пайплайна с нуля,540000.00,56,159500.00
Развёртывание CRM-системы (MVP),540000.00,45,236600.00
Развёртывание CRM-системы,541000.00,47,255900.00
Развёртывание системы аналитики под ключ,542000.00,65,239500.00
Проектирование системы мониторинга (SaaS),542500.00,49,157800.00
Развёртывание платёжного модуля (Enterprise),545000.00,44,188100.00
Развёртывание DevOps-пайплайна под ключ,545000.00,46,213100.00
Проектирование API-сервиса под ключ,546500.00,49,212900.00
Проектирование системы резервного копирования (SaaS),547000.00,42,177700.00
Проектирование API-сервиса (Enterprise),549500.00,56,197400.00
Миграция CRM-системы с нуля,555500.00,46,194100.00
Внедрение нагрузочного тестирования (SaaS),559000.00,66,186900.00
Интеграция ERP-системы (POC),561000.00,42,208100.00
Разработка системы мониторинга (POC),563500.00,53,160000.00
Развёртывание ERP-системы на основе существующего решения,564000.00,45,167100.00
Разработка системы аналитики с нуля,565000.00,69,237500.00
Внедрение веб-приложения (MVP),569000.00,43,249400.00
Внедрение сети доставки контента,569500.00,48,233300.00
Проектирование DevOps-пайплайна (MVP),570000.00,50,172400.00
Интеграция DevOps-пайплайна под ключ,570500.00,60,161500.00
Проектирование API-сервиса (MVP),571000.00,73,145500.00
Интеграция корпоративного портала (MVP),571000.00,71,148600.00
Миграция системы резервного копирования под ключ,571500.00,55,179000.00
Миграция корпоративного портала (MVP),572000.00,41,264300.00
Интеграция DevOps-пайплайна (Enterprise),573500.00,58,243600.00
Проектирование платёжного модуля (MVP),575000.00,73,263100.00
Внедрение CRM-системы на основе существующего решения,576000.00,41,180800.00
Развёртывание платёжного модуля (POC),577500.00,49,162200.00
Разработка нагрузочного тестирования (SaaS),579500.00,69,263700.00
Развёртывание веб-приложения (MVP),581500.00,74,163500.00
Развёртывание системы аутентификации (MVP),584000.00,62,202600.00
Развёртывание системы управления задачами с нуля,584500.00,65,147500.00
Миграция системы управления задачами (Enterprise),585000.00,42,250200.00
Миграция мобильного приложения,586000.00,68,244600.00
Развёртывание системы аутентификации (MVP),587000.00,56,212300.00
Внедрение платёжного модуля под ключ,588000.00,47,236100.00
Миграция системы управления задачами (POC),588000.00,62,241600.00
Развёртывание системы резервного копирования с нуля,592500.00,43,176200.00
Проектирование панели администратора (SaaS),592500.00,65,215500.00
Развёртывание системы аналитики (Enterprise),594000.00,58,190600.00
Интеграция API-сервиса под ключ,595500.00,73,154900.00
Внедрение системы мониторинга (SaaS),596000.00,59,183100.00
Разработка CRM-системы (POC),596000.00,52,246900.00
Миграция системы мониторинга (POC),596500.00,60,158800.00
Проектирование нагрузочного тестирования (POC),599000.00,58,244900.00
Интеграция микросервисной архитектуры (POC),603000.00,65,197000.00
Миграция корпоративного портала (POC),604500.00,67,195800.00
Внедрение DevOps-пайплайна (MVP),612500.00,71,244700.00
Проектирование сети доставки контента (MVP),624000.00,53,264900.00
Разработка DevOps-пайплайна под ключ,626000.00,67,208200.00
Миграция DevOps-пайплайна (Enterprise),632500.00,50,210800.00
Проектирование DevOps-пайплайна (Enterprise),634000.00,76,178200.00
Интеграция системы аутентификации (Enterprise),634000.00,73,232200.00
Внедрение мобильного приложения (Enterprise),636500.00,56,251500.00
Проектирование облачной инфраструктуры под ключ,637500.00,68,220500.00
Миграция системы резервного копирования (SaaS),637500.00,51,245400.00
Проектирование DevOps-пайплайна с нуля,639000.00,52,303600.00
Проектирование чат-бота (MVP),640500.00,56,182900.00
Проектирование системы мониторинга (MVP),647500.00,79,229400.00
Проектирование нагрузочного тестирования (POC),648000.00,60,175900.00
Разработка системы аналитики под ключ,649500.00,59,168400.00
Внедрение API-сервиса с нуля,650500.00,72,172400.00
Внедрение ERP-системы под ключ,651500.00,82,315600.00
Интеграция системы мониторинга (Enterprise),652500.00,76,231300.00
Интеграция системы аналитики,658500.00,65,269200.00
Проектирование нагрузочного тестирования с нуля,659000.00,47,298600.00
Интеграция платёжного модуля под ключ,661000.00,65,222400.00
Миграция ERP-системы (POC),661500.00,69,261400.00
Разработка DevOps-пайплайна (SaaS),668000.00,63,286400.00
Проектирование системы резервного копирования под ключ,670500.00,62,321800.00
Миграция системы аналитики (POC),671500.00,64,234300.00
Интеграция мобильного приложения (SaaS),672000.00,76,243300.00
Внедрение CRM-системы на основе существующего решения,673000.00,83,181800.00
Разработка панели администратора на основе существующего решения,674500.00,52,182500.00
Миграция облачной инфраструктуры под ключ,683000.00,58,200800.00
Проектирование мобильного приложения (POC),685500.00,83,196700.00
