name,cost,duration_days,prepayment
Настройка сети доставки контента (POC),86500.00,11,32200.00
Настройка микросервисной архитектуры на основе существующего решения,52000.00,6,18900.00
Тестирование панели администратора на основе существующего решения,66500.00,8,29300.00
Проектирование корпоративного портала под ключ,597000.00,45,289300.00
Аудит мобильного приложения (POC),214000.00,24,87600.00
Оптимизация микросервисной архитектуры на основе существующего решения,356000.00,25,121500.00
Тестирование системы аутентификации (Enterprise),248500.00,19,108200.00
Интеграция базы данных под ключ,60500.00,5,28600.00
Тестирование системы управления задачами с нуля,316000.00,37,118400.00
Внедрение CRM-системы (SaaS),1271000.00,91,360900.00
Консультация системы аналитики с нуля,59500.00,7,24400.00
Внедрение сети доставки контента под ключ,593500.00,47,217100.00
Проектирование CRM-системы (POC),510000.00,53,218900.00
Сопровождение корпоративного портала (POC),142500.00,11,52600.00
Настройка системы аутентификации (SaaS),28500.00,3,11300.00
Интеграция корпоративного портала (SaaS),625000.00,54,299400.00
Аудит DevOps-пайплайна (Enterprise),104500.00,8,32100.00
Оптимизация системы управления задачами (Enterprise),63000.00,6,30900.00
Оптимизация системы аналитики под ключ,445000.00,51,202100.00
Проектирование корпоративного портала (POC),694500.00,61,301400.00
Интеграция панели администратора (POC),481000.00,42,166400.00
Консультация системы аутентификации,61500.00,5,26000.00
Настройка системы управления задачами,45000.00,6,18400.00
Миграция ERP-системы (MVP),430000.00,56,205200.00
Проектирование системы аутентификации с нуля,624500.00,77,202300.00
Разработка платёжного модуля с нуля,1693500.00,198,431800.00
Сопровождение нагрузочного тестирования (SaaS),109500.00,12,49000.00
Интеграция веб-приложения (Enterprise),616000.00,55,284800.00
Тестирование системы аналитики (POC),327500.00,40,106600.00
Внедрение нагрузочного тестирования на основе существующего решения,1454000.00,176,607900.00
Консультация системы мониторинга на основе существующего решения,77000.00,8,34200.00
Проектирование CRM-системы под ключ,603000.00,71,294800.00
Консультация ERP-системы под ключ,27500.00,3,10100.00
Разработка системы управления задачами (MVP),1881500.00,136,587800.00
Миграция мобильного приложения,797000.00,60,364000.00
Аудит системы управления задачами (MVP),198500.00,20,88800.00
Разработка системы аутентификации с нуля,798000.00,63,241900.00
Проектирование облачной инфраструктуры (MVP),562500.00,62,226300.00
Сопровождение нагрузочного тестирования (SaaS),29500.00,4,9000.00
Интеграция системы резервного копирования с нуля,954000.00,102,332900.00
Тестирование веб-приложения (POC),312500.00,25,102600.00
Тестирование веб-приложения под ключ,198500.00,20,79500.00
Настройка DevOps-пайплайна под ключ,77500.00,10,32900.00
Аудит панели администратора (MVP),227500.00,18,110700.00
Аудит системы аналитики под ключ,262500.00,28,93200.00
Сопровождение мобильного приложения (MVP),107000.00,9,31000.00
Проектирование облачной инфраструктуры с нуля,640000.00,51,194500.00
Настройка облачной инфраструктуры,147000.00,15,66800.00
Интеграция корпоративного портала (SaaS),80500.00,8,22300.00
Сопровождение ERP-системы под ключ,147000.00,13,56500.00
Тестирование сети доставки контента,391500.00,36,161100.00
Миграция системы аутентификации под ключ,377500.00,42,141000.00
Миграция системы мониторинга на основе существующего решения,682000.00,73,189600.00
Внедрение DevOps-пайплайна на основе существующего решения,567000.00,62,152100.00
Настройка нагрузочного тестирования (MVP),29000.00,3,10100.00
Развёртывание корпоративного портала с нуля,215000.00,19,90200.00
Оптимизация панели администратора (POC),247000.00,21,76000.00
Внедрение системы мониторинга (SaaS),879500.00,78,355700.00
Интеграция нагрузочного тестирования (SaaS),1127000.00,105,355800.00
Интеграция базы данных,508000.00,49,164000.00
Проектирование DevOps-пайплайна (Enterprise),297500.00,39,145200.00
Разработка мобильного приложения (SaaS),446000.00,32,114100.00
Миграция нагрузочного тестирования с нуля,49500.00,4,22900.00
Разработка нагрузочного тестирования (SaaS),1612000.00,173,537000.00
Интеграция чат-бота с нуля,161000.00,18,74400.00
Проектирование сети доставки контента на основе существующего решения,645500.00,66,243400.00
Аудит CRM-системы на основе существующего решения,146500.00,14,63100.00
Настройка базы данных под ключ,86500.00,10,31800.00
Консультация системы мониторинга (Enterprise),38000.00,3,18900.00
Консультация чат-бота с нуля,14500.00,2,6800.00
Развёртывание панели администратора с нуля,391000.00,33,128700.00
Настройка микросервисной архитектуры с нуля,160000.00,13,56200.00
Проектирование DevOps-пайплайна (MVP),699500.00,88,191700.00
Развёртывание API-сервиса (SaaS),511500.00,62,151900.00
Проектирование ERP-системы с нуля,265000.00,27,110300.00
Аудит системы резервного копирования,296000.00,25,97400.00
Интеграция системы управления задачами (SaaS),960500.00,107,288000.00
Разработка системы резервного копирования (SaaS),1045500.00,93,476300.00
Тестирование базы данных (MVP),58000.00,6,28000.00
Разработка нагрузочного тестирования на основе существующего решения,1100500.00,95,384800.00
Разработка облачной инфраструктуры с нуля,680500.00,74,209300.00
Оптимизация CRM-системы (MVP),316500.00,40,153100.00
Консультация корпоративного портала (POC),55500.00,7,15300.00
Консультация CRM-системы под ключ,33000.00,3,11400.00
Миграция нагрузочного тестирования на основе существующего решения,252500.00,18,75900.00
Настройка системы резервного копирования (POC),80000.00,9,31400.00
Аудит мобильного приложения (SaaS),26500.00,2,9800.00
Развёртывание облачной инфраструктуры (POC),447500.00,41,201300.00
Проектирование мобильного приложения под ключ,160000.00,20,55800.00
Развёртывание системы мониторинга (POC),438500.00,35,148300.00
Разработка чат-бота,1230000.00,116,413400.00
Сопровождение API-сервиса с нуля,125000.00,11,47400.00
Тестирование мобильного приложения (SaaS),365000.00,43,101700.00
Оптимизация чат-бота на основе существующего решения,428000.00,38,167000.00
Настройка системы резервного копирования под ключ,105000.00,11,32900.00
Развёртывание системы управления задачами на основе существующего решения,586000.00,45,176600.00
Консультация мобильного приложения на основе существующего решения,33000.00,3,8600.00
Интеграция сети доставки контента с нуля,325000.00,37,121700.00
Сопровождение корпоративного портала с нуля,127500.00,11,57900.00
Настройка CRM-системы (POC),10000.00,1,4700.00
Проектирование платёжного модуля под ключ,86500.00,9,40600.00
Разработка микросервисной архитектуры (SaaS),927500.00,104,293900.00
Оптимизация системы аутентификации (SaaS),474000.00,54,135800.00
Внедрение платёжного модуля (Enterprise),826000.00,78,298500.00
Сопровождение системы аналитики,89500.00,9,39100.00
Миграция веб-приложения на основе существующего решения,560000.00,50,226300.00
Миграция ERP-системы под ключ,691500.00,83,210500.00
Оптимизация CRM-системы на основе существующего решения,80000.00,6,25600.00
Консультация API-сервиса (Enterprise),50000.00,4,23600.00
Интеграция нагрузочного тестирования с нуля,818500.00,88,208700.00
Внедрение системы мониторинга с нуля,1058500.00,136,377300.00
Развёртывание облачной инфраструктуры,342000.00,31,113100.00
Сопровождение микросервисной архитектуры (POC),18000.00,2,7900.00
Оптимизация системы резервного копирования,191500.00,14,64200.00
Развёртывание системы мониторинга,163500.00,17,41100.00
Интеграция корпоративного портала с нуля,828500.00,77,385200.00
Сопровождение базы данных под ключ,54000.00,6,20200.00
Миграция системы управления задачами на основе существующего решения,375500.00,35,167700.00
Сопровождение системы аутентификации (Enterprise),82500.00,6,26800.00
Разработка сети доставки контента под ключ,371000.00,36,166400.00
Интеграция веб-приложения (POC),121000.00,13,40900.00
Внедрение веб-приложения на основе существующего решения,1460500.00,174,443200.00
Аудит облачной инфраструктуры (SaaS),183000.00,14,51800.00
Тестирование корпоративного портала на основе существующего решения,302000.00,34,117300.00
Миграция системы управления задачами,318500.00,32,143500.00
Аудит базы данных на основе существующего решения,275500.00,24,79900.00
Тестирование системы управления задачами,164000.00,16,45600.00
Оптимизация базы данных (MVP),270000.00,33,119300.00
Внедрение веб-приложения под ключ,231500.00,26,63100.00
Внедрение чат-бота (MVP),908000.00,107,345700.00
Сопровождение микросервисной архитектуры (SaaS),141500.00,11,57700.00
Интеграция системы аналитики (Enterprise),825000.00,99,388700.00
Настройка панели администратора (POC),51000.00,5,17200.00
Проектирование системы управления задачами на основе существующего решения,770500.00,74,349600.00
Настройка системы мониторинга (MVP),144000.00,18,70800.00
Интеграция DevOps-пайплайна под ключ,157000.00,20,58500.00
Миграция сети доставки контента (POC),342500.00,26,167600.00
Консультация корпоративного портала под ключ,66000.00,6,22600.00
Проектирование API-сервиса (POC),42500.00,4,11800.00
Внедрение системы мониторинга под ключ,261000.00,33,79400.00
Развёртывание панели администратора (SaaS),116000.00,12,39600.00
Разработка мобильного приложения (MVP),1830500.00,187,871800.00
Проектирование CRM-системы (Enterprise),221000.00,26,105200.00
Интеграция микросервисной архитектуры (Enterprise),264500.00,34,78500.00
Сопровождение платёжного модуля,106500.00,9,38600.00
Проектирование нагрузочного тестирования с нуля,498500.00,41,237200.00
Проектирование системы аналитики (POC),287500.00,28,133200.00
Внедрение веб-приложения (Enterprise),559500.00,42,259400.00
Разработка мобильного приложения (MVP),1965500.00,225,701400.00
Интеграция ERP-системы (POC),659000.00,82,326000.00
Настройка системы мониторинга (MVP),183000.00,13,68500.00
Консультация панели администратора,23000.00,2,8000.00
Разработка облачной инфраструктуры (MVP),1161000.00,130,343500.00
Аудит сети доставки контента на основе существующего решения,156500.00,11,69500.00
Тестирование системы аутентификации (POC),344500.00,37,119200.00
Внедрение чат-бота,1077500.00,127,438300.00
Консультация базы данных (Enterprise),24500.00,2,9400.00
Разработка корпоративного портала (POC),970000.00,89,334000.00
Аудит системы аутентификации (Enterprise),202000.00,25,63100.00
Тестирование облачной инфраструктуры (POC),97500.00,11,29300.00
Проектирование ERP-системы,715500.00,53,242900.00
Аудит CRM-системы (SaaS),70500.00,6,25300.00
Миграция системы мониторинга (POC),492500.00,36,197900.00
Сопровождение нагрузочного тестирования под ключ,34500.00,3,10500.00
Консультация нагрузочного тестирования,56500.00,6,24600.00
Развёртывание корпоративного портала с нуля,487000.00,48,202900.00
Разработка облачной инфраструктуры (Enterprise),304500.00,39,113200.00
Тестирование системы резервного копирования (POC),238000.00,26,70100.00
Интеграция сети доставки контента (MVP),342000.00,30,140200.00
Оптимизация системы резервного копирования с нуля,474000.00,61,236700.00
Миграция системы аналитики (SaaS),873000.00,84,321100.00
Миграция сети доставки контента под ключ,808000.00,96,306900.00
Миграция API-сервиса с нуля,293000.00,31,90700.00
Тестирование чат-бота (Enterprise),363500.00,31,163600.00
Интеграция корпоративного портала (Enterprise),193000.00,17,51300.00
Проектирование CRM-системы на основе существующего решения,639000.00,72,294000.00
Аудит CRM-системы на основе существующего решения,207500.00,22,95600.00
Настройка базы данных с нуля,68000.00,8,19900.00
Проектирование мобильного приложения (SaaS),110500.00,9,48600.00
Миграция системы аналитики (MVP),484000.00,35,205000.00
Развёртывание корпоративного портала на основе существующего решения,206500.00,25,63700.00
Разработка системы аутентификации с нуля,1093500.00,137,309800.00
Проектирование системы аутентификации,651000.00,69,256200.00
Проектирование CRM-системы,420500.00,35,164600.00
Оптимизация системы мониторинга (SaaS),489500.00,48,129200.00
Развёртывание API-сервиса (MVP),176000.00,13,58600.00
Оптимизация ERP-системы с нуля,189500.00,17,89000.00
Миграция панели администратора (POC),758500.00,93,302000.00
Сопровождение системы мониторинга (POC),117500.00,15,46100.00
Внедрение системы мониторинга под ключ,1270500.00,115,332200.00
Миграция нагрузочного тестирования на основе существующего решения,692000.00,82,228300.00
Интеграция нагрузочного тестирования с нуля,440000.00,48,129100.00
Настройка сети доставки контента,11500.00,1,3600.00
Миграция системы управления задачами (Enterprise),591500.00,71,268000.00
Настройка DevOps-пайплайна под ключ,45500.00,5,13600.00
Оптимизация платёжного модуля (SaaS),327500.00,26,92700.00
Оптимизация DevOps-пайплайна под ключ,137500.00,14,37900.00
Интеграция системы аналитики с нуля,485500.00,56,140100.00
Проектирование ERP-системы (MVP),379500.00,36,101300.00
Настройка базы данных (MVP),99500.00,12,33000.00
Консультация системы аналитики на основе существующего решения,23000.00,2,11200.00
Сопровождение API-сервиса (SaaS),90500.00,8,26600.00
Интеграция облачной инфраструктуры под ключ,835500.00,81,324000.00
Тестирование API-сервиса (Enterprise),380000.00,47,173100.00
Оптимизация платёжного модуля,297000.00,23,124900.00
Развёртывание мобильного приложения (Enterprise),184500.00,14,88600.00
Проектирование облачной инфраструктуры (MVP),750000.00,67,235400.00
Оптимизация облачной инфраструктуры на основе существующего решения,454000.00,55,202700.00
Настройка микросервисной архитектуры под ключ,106500.00,13,50200.00
Сопровождение веб-приложения (POC),101000.00,9,31000.00
Тестирование DevOps-пайплайна (MVP),380000.00,32,158000.00
Развёртывание DevOps-пайплайна (SaaS),448000.00,49,120600.00
Миграция сети доставки контента (SaaS),466000.00,39,154800.00
Оптимизация нагрузочного тестирования с нуля,234000.00,20,90800.00
Интеграция системы мониторинга (SaaS),314000.00,29,93900.00
Проектирование системы резервного копирования (POC),44000.00,5,13500.00
Миграция микросервисной архитектуры (MVP),748500.00,86,227600.00
Оптимизация базы данных (POC),94500.00,10,43500.00
Разработка мобильного приложения на основе существующего решения,1282000.00,122,602800.00
Внедрение облачной инфраструктуры,605500.00,73,282900.00
Оптимизация мобильного приложения (POC),159500.00,12,47000.00
Развёртывание системы мониторинга (SaaS),525000.00,67,236500.00
Тестирование сети доставки контента под ключ,39500.00,4,13800.00
Проектирование корпоративного портала (SaaS),567000.00,43,214500.00
Развёртывание системы аутентификации (SaaS),49500.00,6,13300.00
Сопровождение системы аутентификации (MVP),137500.00,17,42700.00
Аудит API-сервиса (Enterprise),22500.00,2,9500.00
Консультация платёжного модуля (POC),74500.00,7,36800.00
Внедрение платёжного модуля (Enterprise),846500.00,109,215500.00
Интеграция платёжного модуля (MVP),972000.00,120,480100.00
Настройка API-сервиса (MVP),74000.00,7,25800.00
Тестирование системы управления задачами (SaaS),315000.00,30,113700.00
Настройка системы мониторинга (MVP),185000.00,13,84400.00
Миграция ERP-системы (SaaS),821000.00,70,246100.00
Миграция микросервисной архитектуры (Enterprise),573500.00,52,151700.00
Тестирование DevOps-пайплайна (SaaS),270500.00,19,89600.00
Проектирование системы аналитики (MVP),647000.00,53,173000.00
Консультация базы данных под ключ,27500.00,3,8400.00
Внедрение сети доставки контента (MVP),140000.00,10,46200.00
Проектирование панели администратора,767000.00,83,372400.00
Оптимизация CRM-системы под ключ,212000.00,20,73000.00
Разработка системы аутентификации на основе существующего решения,1373500.00,103,646200.00
Оптимизация корпоративного портала (SaaS),281000.00,34,94500.00
Тестирование ERP-системы (MVP),364000.00,26,143700.00
Консультация DevOps-пайплайна с нуля,71000.00,9,34200.00
Аудит API-сервиса (MVP),213500.00,19,103700.00
Сопровождение мобильного приложения (MVP),33000.00,3,14300.00
Внедрение базы данных (MVP),926500.00,91,422600.00
Аудит мобильного приложения,134000.00,10,51600.00
Миграция системы управления задачами на основе существующего решения,674500.00,52,282400.00
Проектирование мобильного приложения,739500.00,69,368100.00
Разработка ERP-системы на основе существующего решения,755000.00,66,215000.00
Оптимизация системы резервного копирования под ключ,221500.00,26,93700.00
Внедрение системы управления задачами (Enterprise),194000.00,25,71700.00
Интеграция панели администратора (POC),473500.00,48,204300.00
Внедрение веб-приложения с нуля,984000.00,70,326500.00
Интеграция системы мониторинга,516000.00,61,238400.00
Аудит системы управления задачами (SaaS),233500.00,20,102700.00
Разработка веб-приложения с нуля,1904500.00,134,941400.00
Внедрение чат-бота с нуля,1368500.00,162,401700.00
Настройка облачной инфраструктуры,139000.00,14,55600.00
Настройка сети доставки контента (Enterprise),77500.00,8,31500.00
Развёртывание DevOps-пайплайна (MVP),143500.00,18,67800.00
Развёртывание мобильного приложения (MVP),73500.00,8,18400.00
Миграция системы управления задачами (SaaS),281000.00,21,71100.00
Сопровождение чат-бота с нуля,68500.00,6,21100.00
Разработка DevOps-пайплайна (POC),1460500.00,144,730000.00
Интеграция API-сервиса на основе существующего решения,442500.00,40,179400.00
Интеграция DevOps-пайплайна под ключ,397500.00,46,157200.00
