name,cost,duration_days,prepayment
Миграция сети доставки контента на основе существующего решения,646000.00,55,175400.00
Интеграция API-сервиса,830000.00,78,414300.00
Оптимизация DevOps-пайплайна (SaaS),86500.00,9,42600.00
Разработка системы аналитики на основе существующего решения,1420000.00,177,504600.00
Миграция панели администратора (MVP),97500.00,10,47400.00
Интеграция системы мониторинга на основе существующего решения,340500.00,32,121800.00
Настройка системы аналитики с нуля,17000.00,1,4900.00
Аудит корпоративного портала (SaaS),103500.00,8,42900.00
Тестирование ERP-системы (Enterprise),201000.00,14,98400.00
Разработка платёжного модуля (SaaS),483000.00,47,227700.00
Проектирование DevOps-пайплайна (Enterprise),442500.00,45,146600.00
Консультация системы аутентификации (POC),46500.00,4,12900.00
Консультация API-сервиса,52000.00,4,22200.00
Проектирование DevOps-пайплайна (POC),412500.00,32,173600.00
Консультация сети доставки контента (Enterprise),28500.00,3,7100.00
Внедрение API-сервиса под ключ,384500.00,41,124900.00
Внедрение панели администратора на основе существующего решения,191500.00,25,52700.00
Настройка платёжного модуля на основе существующего решения,35500.00,3,10500.00
Настройка системы мониторинга (SaaS),150500.00,12,53400.00
Тестирование CRM-системы с нуля,26000.00,2,12800.00
Настройка платёжного модуля (Enterprise),18500.00,2,8200.00
Аудит корпоративного портала (POC),208500.00,23,80300.00
Разработка системы аналитики (Enterprise),271000.00,32,90400.00
Внедрение системы управления задачами (Enterprise),587500.00,54,293400.00
Разработка ERP-системы (SaaS),1404000.00,126,357300.00
Внедрение системы резервного копирования (Enterprise),735000.00,80,210800.00
Аудит системы резервного копирования,165000.00,13,82200.00
Оптимизация облачной инфраструктуры (POC),169000.00,18,54900.00
Интеграция системы управления задачами,657500.00,47,265900.00
Консультация облачной инфраструктуры (SaaS),79000.00,6,29900.00
Тестирование чат-бота (POC),273000.00,34,130800.00
Внедрение базы данных (SaaS),325000.00,28,123800.00
Тестирование базы данных на основе существующего решения,46000.00,5,12500.00
Интеграция базы данных на основе существующего решения,1145500.00,81,495200.00
Консультация сети доставки контента (MVP),20000.00,2,9000.00
Проектирование системы аналитики (POC),290500.00,24,78000.00
Аудит ERP-системы с нуля,70500.00,8,31300.00
Настройка платёжного модуля (SaaS),46500.00,4,21900.00
Проектирование облачной инфраструктуры с нуля,603500.00,53,240600.00
Настройка базы данных с нуля,192000.00,14,69200.00
Интеграция сети доставки контента на основе существующего решения,289000.00,26,144200.00
Настройка мобильного приложения (POC),191000.00,23,61400.00
Оптимизация CRM-системы с нуля,306500.00,31,90200.00
Тестирование системы аутентификации на основе существующего решения,70000.00,6,32300.00
Сопровождение CRM-системы (POC),50000.00,4,15600.00
Настройка системы мониторинга (Enterprise),151000.00,14,44800.00
Внедрение системы управления задачами (POC),470000.00,44,162600.00
Интеграция веб-приложения (MVP),1148000.00,105,299800.00
Развёртывание системы мониторинга (Enterprise),433000.00,53,161600.00
Развёртывание нагрузочного тестирования,474000.00,48,168300.00
Интеграция системы аутентификации (MVP),554000.00,53,238900.00
Разработка нагрузочного тестирования (POC),818500.00,87,262300.00
Развёртывание CRM-системы с нуля,42500.00,4,10800.00
Внедрение системы мониторинга (SaaS),1364500.00,136,412700.00
Настройка микросервисной архитектуры на основе существующего решения,36000.00,3,16600.00
Настройка сети доставки контента (Enterprise),34500.00,4,16200.00
Тестирование системы аутентификации,174000.00,16,81900.00
Оптимизация базы данных,167500.00,17,81300.00
Проектирование корпоративного портала (MVP),651500.00,65,300200.00
Развёртывание системы мониторинга под ключ,574000.00,49,182300.00
Сопровождение нагрузочного тестирования (MVP),83500.00,8,28300.00
Консультация DevOps-пайплайна,56000.00,6,22800.00
Оптимизация API-сервиса (POC),179500.00,21,49500.00
Консультация корпоративного портала (SaaS),53000.00,4,14500.00
Интеграция нагрузочного тестирования с нуля,853000.00,60,405000.00
Разработка базы данных с нуля,785000.00,93,247700.00
Проектирование ERP-системы (Enterprise),557500.00,47,266700.00
Интеграция системы аналитики на основе существующего решения,700500.00,58,256400.00
Оптимизация платёжного модуля (MVP),275000.00,31,117600.00
Разработка платёжного модуля (SaaS),784000.00,65,210600.00
Разработка сети доставки контента (MVP),1645000.00,212,705100.00
Оптимизация системы аналитики с нуля,460500.00,45,165300.00
Оптимизация CRM-системы (MVP),95000.00,7,31200.00
Развёртывание системы резервного копирования (MVP),438500.00,55,127300.00
Проектирование API-сервиса,510500.00,60,158600.00
Тестирование системы резервного копирования с нуля,379500.00,35,133400.00
Аудит системы мониторинга под ключ,208500.00,20,94500.00
Аудит мобильного приложения (Enterprise),208500.00,15,97400.00
Аудит базы данных,56500.00,4,26100.00
Настройка панели администратора (SaaS),37500.00,5,15600.00
Настройка системы аналитики,156500.00,14,59200.00
Тестирование мобильного приложения (MVP),30000.00,4,14200.00
Консультация микросервисной архитектуры (MVP),51500.00,4,24400.00
Консультация базы данных с нуля,57000.00,5,21300.00
Миграция мобильного приложения (Enterprise),488000.00,42,210100.00
Проектирование базы данных (MVP),120000.00,9,49300.00
Оптимизация микросервисной архитектуры (SaaS),47500.00,3,22900.00
Развёртывание DevOps-пайплайна (POC),230500.00,26,75700.00
Консультация панели администратора (Enterprise),21000.00,2,10100.00
Тестирование платёжного модуля,64000.00,7,16900.00
Миграция ERP-системы с нуля,706000.00,71,260700.00
Сопровождение веб-приложения (POC),126500.00,12,53500.00
Тестирование системы управления задачами на основе существующего решения,200500.00,23,57000.00
Развёртывание панели администратора с нуля,212500.00,20,106000.00
Развёртывание облачной инфраструктуры (MVP),271500.00,20,100200.00
Интеграция системы аутентификации (Enterprise),826500.00,87,359900.00
Интеграция системы аутентификации (Enterprise),870500.00,90,368300.00
Миграция мобильного приложения (SaaS),741000.00,92,355000.00
Аудит облачной инфраструктуры (POC),58500.00,4,26500.00
Консультация системы резервного копирования под ключ,37000.00,3,16200.00
Интеграция микросервисной архитектуры под ключ,683000.00,67,185600.00
Аудит API-сервиса под ключ,22000.00,2,10600.00
Развёртывание сети доставки контента (MVP),463000.00,40,222900.00
Сопровождение базы данных на основе существующего решения,59500.00,5,24500.00
Консультация чат-бота,28000.00,3,8400.00
Настройка нагрузочного тестирования,85000.00,7,40700.00
Интеграция системы управления задачами (MVP),124500.00,12,34200.00
Интеграция чат-бота под ключ,210000.00,18,100900.00
Развёртывание чат-бота (SaaS),207500.00,25,53200.00
Оптимизация системы резервного копирования,486500.00,62,187500.00
Оптимизация ERP-системы на основе существующего решения,420000.00,52,157400.00
Сопровождение ERP-системы под ключ,33000.00,4,8700.00
Настройка базы данных (Enterprise),60000.00,6,28700.00
Интеграция системы резервного копирования (MVP),992000.00,82,426100.00
Миграция мобильного приложения на основе существующего решения,221500.00,19,84900.00
Тестирование сети доставки контента (SaaS),370000.00,42,167900.00
Сопровождение облачной инфраструктуры на основе существующего решения,92000.00,11,32000.00
Развёртывание корпоративного портала (SaaS),94000.00,10,38600.00
Проектирование чат-бота (Enterprise),57500.00,6,27100.00
Проектирование сети доставки контента с нуля,754000.00,83,209600.00
Интеграция чат-бота на основе существующего решения,831500.00,60,361200.00
Оптимизация нагрузочного тестирования (POC),155000.00,20,54400.00
Разработка нагрузочного тестирования с нуля,296000.00,27,125700.00
Тестирование системы аутентификации под ключ,368000.00,29,124700.00
Оптимизация облачной инфраструктуры (Enterprise),431000.00,53,143700.00
Аудит нагрузочного тестирования,287500.00,30,91200.00
Разработка мобильного приложения на основе существующего решения,881500.00,77,304500.00
Аудит базы данных (MVP),57000.00,7,25300.00
Развёртывание DevOps-пайплайна на основе существующего решения,210000.00,26,58400.00
Разработка CRM-системы под ключ,657000.00,54,261600.00
Внедрение системы резервного копирования (POC),404000.00,36,199000.00
Интеграция CRM-системы (MVP),632500.00,50,161200.00
Тестирование системы мониторинга (SaaS),150500.00,15,61500.00
Настройка сети доставки контента с нуля,16500.00,1,4200.00
Проектирование мобильного приложения под ключ,386500.00,41,148500.00
Тестирование ERP-системы под ключ,71000.00,7,20400.00
Развёртывание веб-приложения (Enterprise),93000.00,9,28500.00
Внедрение системы мониторинга с нуля,201500.00,16,79700.00
Проектирование CRM-системы на основе существующего решения,571500.00,56,145800.00
Проектирование веб-приложения с нуля,651500.00,55,246700.00
Оптимизация панели администратора на основе существующего решения,41500.00,4,13700.00
Оптимизация системы резервного копирования (Enterprise),331000.00,34,89300.00
Проектирование веб-приложения (Enterprise),189000.00,22,66100.00
Внедрение мобильного приложения (MVP),583000.00,59,165300.00
Интеграция системы мониторинга на основе существующего решения,430500.00,54,140700.00
Сопровождение базы данных,24000.00,3,10800.00
Интеграция облачной инфраструктуры (MVP),735000.00,85,184700.00
Настройка веб-приложения под ключ,170500.00,17,62200.00
Настройка системы мониторинга (MVP),176500.00,19,75700.00
Развёртывание API-сервиса (POC),86500.00,7,29300.00
Интеграция панели администратора (MVP),663000.00,62,186600.00
Миграция API-сервиса с нуля,895000.00,100,260800.00
Аудит веб-приложения (MVP),271000.00,29,85500.00
Внедрение системы мониторинга,1438000.00,187,388500.00
Развёртывание платёжного модуля под ключ,330000.00,39,120000.00
Сопровождение API-сервиса на основе существующего решения,69000.00,8,26800.00
Интеграция системы аналитики (Enterprise),1188500.00,124,455900.00
Тестирование микросервисной архитектуры,212500.00,24,59200.00
Проектирование ERP-системы (SaaS),410000.00,36,203800.00
Миграция чат-бота,551500.00,59,172500.00
Настройка API-сервиса (Enterprise),65000.00,7,26300.00
Проектирование панели администратора,58000.00,5,22200.00
Тестирование системы резервного копирования с нуля,217500.00,27,72100.00
Развёртывание мобильного приложения на основе существующего решения,327000.00,26,148600.00
Развёртывание веб-приложения (SaaS),504500.00,58,148300.00
Тестирование корпоративного портала (Enterprise),265000.00,30,130200.00
Консультация DevOps-пайплайна (Enterprise),17000.00,1,4900.00
Тестирование ERP-системы (MVP),222000.00,25,99900.00
Консультация корпоративного портала под ключ,52000.00,6,18800.00
Разработка системы аналитики,949500.00,70,457600.00
Тестирование системы резервного копирования (POC),114000.00,12,43200.00
Тестирование облачной инфраструктуры (SaaS),273000.00,35,125400.00
Тестирование DevOps-пайплайна на основе существующего решения,203500.00,21,60700.00
Внедрение мобильного приложения под ключ,1067000.00,118,436600.00
Оптимизация нагрузочного тестирования,311000.00,34,123000.00
Проектирование системы аналитики (Enterprise),429500.00,48,204300.00
Миграция системы аутентификации под ключ,181500.00,14,66000.00
Аудит системы аутентификации (POC),287000.00,35,103700.00
Миграция мобильного приложения (MVP),57000.00,4,28200.00
Проектирование системы резервного копирования (MVP),701500.00,55,286500.00
Оптимизация веб-приложения (POC),358500.00,46,161200.00
Интеграция мобильного приложения под ключ,97500.00,11,41700.00
Аудит системы аналитики (SaaS),173500.00,13,58700.00
Проектирование нагрузочного тестирования (MVP),164500.00,20,63900.00
Настройка CRM-системы (POC),148000.00,18,49000.00
Тестирование корпоративного портала,362000.00,31,176000.00
Консультация мобильного приложения (Enterprise),58000.00,7,24300.00
Консультация облачной инфраструктуры (SaaS),12500.00,2,4700.00
Миграция CRM-системы (SaaS),756000.00,54,311400.00
Консультация API-сервиса на основе существующего решения,45000.00,5,14600.00
Оптимизация ERP-системы,38000.00,5,15000.00
Тестирование API-сервиса,386500.00,37,119700.00
Настройка ERP-системы (MVP),60500.00,5,17100.00
Проектирование чат-бота с нуля,689000.00,69,199200.00
Разработка нагрузочного тестирования (SaaS),1791500.00,167,643900.00
Разработка системы мониторинга (POC),279000.00,35,99000.00
Внедрение микросервисной архитектуры (SaaS),1224500.00,96,434300.00
Разработка нагрузочного тестирования с нуля,1104000.00,119,423800.00
Развёртывание ERP-системы (SaaS),546500.00,38,220000.00
Миграция нагрузочного тестирования (SaaS),417000.00,48,202700.00
Консультация системы аутентификации,73000.00,9,30700.00
Разработка базы данных,393500.00,47,147700.00
Тестирование системы мониторинга,117500.00,15,53100.00
Разработка корпоративного портала на основе существующего решения,1356000.00,118,603200.00
Тестирование мобильного приложения (MVP),133000.00,16,63300.00
Настройка ERP-системы под ключ,121000.00,13,50100.00
Аудит мобильного приложения (SaaS),33500.00,3,9900.00
Консультация системы резервного копирования (MVP),11500.00,1,4000.00
Внедрение чат-бота на основе существующего решения,849000.00,72,395200.00
Тестирование чат-бота (POC),319500.00,40,152200.00
Настройка чат-бота под ключ,183500.00,19,71000.00
Тестирование панели администратора (POC),139500.00,17,43400.00
Разработка системы управления задачами (Enterprise),372000.00,28,96300.00
Настройка системы управления задачами,54500.00,7,20400.00
Миграция сети доставки контента (POC),395000.00,29,135200.00
Разработка корпоративного портала под ключ,83000.00,11,27500.00
Тестирование мобильного приложения (SaaS),188500.00,14,85500.00
Аудит веб-приложения (MVP),158500.00,14,50800.00
Внедрение микросервисной архитектуры с нуля,1395000.00,134,362700.00
Консультация DevOps-пайплайна на основе существующего решения,72500.00,6,30600.00
Оптимизация ERP-системы под ключ,407000.00,51,155100.00
Развёртывание системы резервного копирования с нуля,273000.00,33,130600.00
Оптимизация системы аутентификации (MVP),119000.00,10,53900.00
Внедрение DevOps-пайплайна,930000.00,84,296000.00
Оптимизация мобильного приложения под ключ,478500.00,42,120400.00
Аудит системы резервного копирования под ключ,252000.00,18,107500.00
Внедрение API-сервиса (Enterprise),882500.00,106,384000.00
Интеграция корпоративного портала на основе существующего решения,431500.00,51,136900.00
Консультация платёжного модуля (Enterprise),42500.00,5,15000.00
Оптимизация облачной инфраструктуры (MVP),67500.00,8,20200.00
Тестирование мобильного приложения (MVP),156500.00,20,49000.00
Консультация CRM-системы на основе существующего решения,8500.00,1,2500.00
Развёртывание базы данных под ключ,493500.00,47,230000.00
Настройка DevOps-пайплайна (SaaS),106500.00,11,41300.00
Настройка CRM-системы,185000.00,16,48600.00
Разработка облачной инфраструктуры (POC),1238000.00,113,500800.00
Разработка нагрузочного тестирования (POC),1762500.00,194,775800.00
Проектирование облачной инфраструктуры (SaaS),240500.00,24,90300.00
Настройка DevOps-пайплайна под ключ,157500.00,15,75900.00
Интеграция системы аутентификации (Enterprise),1088500.00,110,498600.00
Сопровождение панели администратора,43000.00,3,13000.00
Тестирование системы аутентификации с нуля,263500.00,26,128200.00
Оптимизация платёжного модуля (Enterprise),237000.00,27,94700.00
Консультация чат-бота (Enterprise),60500.00,5,25900.00
Настройка мобильного приложения (MVP),172000.00,20,63300.00
Проектирование веб-приложения,746500.00,65,330500.00
Интеграция веб-приложения (SaaS),611000.00,65,283900.00
Внедрение нагрузочного тестирования с нуля,388000.00,48,179100.00
Разработка системы резервного копирования под ключ,1829500.00,142,527800.00
Оптимизация сети доставки контента под ключ,45000.00,4,19600.00
Консультация системы аналитики (SaaS),80000.00,10,36500.00
Интеграция системы резервного копирования (POC),329500.00,23,87300.00
Настройка сети доставки контента (MVP),91000.00,9,43000.00
Настройка мобильного приложения,161000.00,12,56400.00
Тестирование облачной инфраструктуры (Enterprise),183000.00,22,74700.00
Миграция микросервисной архитектуры,299000.00,34,97400.00
Внедрение сети доставки контента (SaaS),1122000.00,87,555600.00
Настройка системы мониторинга на основе существующего решения,59000.00,8,23500.00
Развёртывание CRM-системы (MVP),59000.00,6,21300.00
Внедрение базы данных (POC),492500.00,57,209100.00
Аудит системы аутентификации на основе существующего решения,117500.00,13,45700.00
Проектирование системы управления задачами (MVP),428500.00,44,182100.00
Сопровождение системы аутентификации с нуля,44000.00,4,13000.00
Миграция API-сервиса на основе существующего решения,608000.00,71,195600.00
Миграция мобильного приложения,636000.00,49,306000.00
Аудит DevOps-пайплайна (MVP),222500.00,17,58300.00
Аудит системы аутентификации (SaaS),15000.00,1,7300.00
Внедрение системы аналитики (MVP),747000.00,97,358400.00
Тестирование системы резервного копирования с нуля,88000.00,7,26500.00
Настройка нагрузочного тестирования (SaaS),35500.00,3,15500.00
Аудит DevOps-пайплайна (MVP),209500.00,27,82800.00
Аудит базы данных (MVP),291000.00,32,82400.00
Тестирование системы аутентификации (SaaS),54000.00,4,13500.00
